{
  "name": "Example Server",
  "author": "ExampleAuthor",
  "version": "1.0.0",
  "description": "Server files.",
  "fileApi": "https://example.com/files",
  "files": [
    {
      "path": "mods/example.jar",
      "hash": "3333333333333333333333333333333333333333",
      "downloadURL": null
    }
  ],
  "addons": [
    { "id": "game", "version": "1.20.1" },
    { "id": "forge", "version": "47.2.0" }
  ]
}
